{
  "$schema": "schemas/task-source-lock.schema.json",
  "schemaVersion": "1.0.0",
  "packageRevision": "v0.21.19_B16_completed",
  "generatedOn": "2026-08-01",
  "taskAuthority": "specs/001-fundamental-analysis-platform/tasks.md",
  "tasksFileSha256": "1d49528244a42302df7b8fe57e257ee42d64c9de43e1f874f1197e32e6c2d32c",
  "taskCount": 109,
  "tasks": [
    {
      "taskId": "T001",
      "lineNumber": 24,
      "sourceTaskSha256": "9cc908c109daa020339247bac144abdca7b0615844c9aa5643877803284d3d12"
    },
    {
      "taskId": "T002",
      "lineNumber": 25,
      "sourceTaskSha256": "1a0330f2cdcde4d63d1b8267515e60fb12d84adcaa9fbf27532d5531f807ca2a"
    },
    {
      "taskId": "T003",
      "lineNumber": 26,
      "sourceTaskSha256": "5d4486fc86d0e109bc748e1390b55f3c704b139fb4ecb953a28506e945a35cfb"
    },
    {
      "taskId": "T004",
      "lineNumber": 27,
      "sourceTaskSha256": "74dfa35752d380563f2122222a802b9af21fead36148242b4d61ed73d328f9db"
    },
    {
      "taskId": "T005",
      "lineNumber": 28,
      "sourceTaskSha256": "17ee22069c02b947ea406f4c9224d686b55c9d60b0db5b785917485f32e98166"
    },
    {
      "taskId": "T006",
      "lineNumber": 29,
      "sourceTaskSha256": "78876cb0c1e6b48126e3112059af3b82d77a7ae40b1e84399d5e98621f75f39c"
    },
    {
      "taskId": "T007",
      "lineNumber": 30,
      "sourceTaskSha256": "e607162ac4b889780a9ec0d860d42a60652cae66c3974e93011270e2f9d8f8b5"
    },
    {
      "taskId": "T008",
      "lineNumber": 31,
      "sourceTaskSha256": "41af30c82dee362590147bd5b4718b587fa885d5ffaab7418a2fc0c61ede15c3"
    },
    {
      "taskId": "T009",
      "lineNumber": 32,
      "sourceTaskSha256": "a683962890534618303a2fd4652dfdbf80b6baa336a1bbf1dc449dfb4090615a"
    },
    {
      "taskId": "T010",
      "lineNumber": 33,
      "sourceTaskSha256": "f7a60120ff89af2570d428f376a17f17bb109c61713e7adbe7e43740f53e728f"
    },
    {
      "taskId": "T011",
      "lineNumber": 39,
      "sourceTaskSha256": "b5ca04919f66d0bf24e580a0f94e621ba689381e750badf99d349e0442132797"
    },
    {
      "taskId": "T012",
      "lineNumber": 40,
      "sourceTaskSha256": "849291c1aefaff902c887b0b0e28decdb1f0fdd285c12915e9a942a8137024ce"
    },
    {
      "taskId": "T013",
      "lineNumber": 41,
      "sourceTaskSha256": "930a591306f00c8bddd4c203b7ab7d3515c702c69f2fde2592c580e68da7c6ea"
    },
    {
      "taskId": "T014",
      "lineNumber": 42,
      "sourceTaskSha256": "2acf2e16cd1f927ac6b45b20de1e6440311463789f1512e3144b3d8c597c5928"
    },
    {
      "taskId": "T015",
      "lineNumber": 43,
      "sourceTaskSha256": "949b610cf0373ab39f0b2ca5e66b6cf66f9d4682d0f92b2cac47dee80470c578"
    },
    {
      "taskId": "T016",
      "lineNumber": 44,
      "sourceTaskSha256": "541a1581d36e1e1ab54a4dc753561a4b124fb5a7ff97829ab67a25aaa737517b"
    },
    {
      "taskId": "T017",
      "lineNumber": 45,
      "sourceTaskSha256": "0c7b44cc8dabc16a43c4aaddbda006e9ea2da64817fbebd75543fa1b3bbb5640"
    },
    {
      "taskId": "T018",
      "lineNumber": 46,
      "sourceTaskSha256": "f022df967e0b6f6486f41fe54b45b0c0f9125f4554118d5cd8a2b6e5630b8bb5"
    },
    {
      "taskId": "T019",
      "lineNumber": 47,
      "sourceTaskSha256": "b45eb64fe3472c3e2f19cca66fc8779feb57cd59b26cbc6f5c7a096be93a2843"
    },
    {
      "taskId": "T020",
      "lineNumber": 48,
      "sourceTaskSha256": "a5e6e7c3fc4f10ceb5e1d5f065e72fdafb0b33acd5b4551f81fdc6b9a3172fd4"
    },
    {
      "taskId": "T021",
      "lineNumber": 49,
      "sourceTaskSha256": "17c9109bb511a0e71302d19bb0cb98c4243dafa0520461fe43515863516f00dc"
    },
    {
      "taskId": "T022",
      "lineNumber": 50,
      "sourceTaskSha256": "8a9e84722c47790ebe3d687a8cbc4c36b08baa45833783c8cf52a8594d4fb9c0"
    },
    {
      "taskId": "T023",
      "lineNumber": 51,
      "sourceTaskSha256": "0c8a8f8ce1bc1307812a4f01099a9e7b02602ef9fb8b52097caa7b5f516b938f"
    },
    {
      "taskId": "T024",
      "lineNumber": 59,
      "sourceTaskSha256": "dc1306d7bda9652c48217f4681d80c18f5964997237431039d6fb91ad0d0ec3c"
    },
    {
      "taskId": "T025",
      "lineNumber": 60,
      "sourceTaskSha256": "f848e7f06a5ac12b54a613d61c2f3f88fdcf3095df6d395153e4eb1c24ae7db4"
    },
    {
      "taskId": "T026",
      "lineNumber": 61,
      "sourceTaskSha256": "1f1969759271d69337376c9c615b79188f6122f882b5b94f1202789106a5b6b0"
    },
    {
      "taskId": "T027",
      "lineNumber": 62,
      "sourceTaskSha256": "3333bd85f02f6ff6e805f53dfe2fd59eeba9c4a4134e9eb6491e1021262bc290"
    },
    {
      "taskId": "T028",
      "lineNumber": 63,
      "sourceTaskSha256": "29e883b3cf18d5bc8bf615bef55345395d4a1b434b019a136b2e41218d32a840"
    },
    {
      "taskId": "T029",
      "lineNumber": 64,
      "sourceTaskSha256": "c345854c78b48555ed9549013b7b749797ef95a712e27d7726e5243e8968261a"
    },
    {
      "taskId": "T030",
      "lineNumber": 65,
      "sourceTaskSha256": "09bd532630ed57be2b58f5f668092130bc8954d50c961c6d1234c4a53951c12e"
    },
    {
      "taskId": "T031",
      "lineNumber": 66,
      "sourceTaskSha256": "9af3666d52654173864ad25dfa67da3243f447741d70b8fc5a87520322d22335"
    },
    {
      "taskId": "T032",
      "lineNumber": 67,
      "sourceTaskSha256": "bb5932b1432ad60d30b281b66957800e4422660072a4f90c437159efb09dfd80"
    },
    {
      "taskId": "T033",
      "lineNumber": 68,
      "sourceTaskSha256": "86e28edb470034dd8c5fa6c530a91d75629e95904287b860f2329a2f663c86de"
    },
    {
      "taskId": "T034",
      "lineNumber": 69,
      "sourceTaskSha256": "e0fc3774a8c936286293f4b08fa1cd51d8759ae38822d01c72b5112876eb951d"
    },
    {
      "taskId": "T035",
      "lineNumber": 70,
      "sourceTaskSha256": "3aff182efae69123ce261935797de9dddffb54cf315772b2428f52edf249bb4a"
    },
    {
      "taskId": "T036",
      "lineNumber": 78,
      "sourceTaskSha256": "4639bb854f14e40b1c31f6ee060268f7cf749bf2f06c3d51081f8d304f84fef7"
    },
    {
      "taskId": "T037",
      "lineNumber": 79,
      "sourceTaskSha256": "a3c2a6cb602fb21a633bb360eb6fbf86a97067a24a05f4d19db1080c762777dd"
    },
    {
      "taskId": "T038",
      "lineNumber": 80,
      "sourceTaskSha256": "abd779af0e31352c89a7014bf40af56c5a3a9bc3816d6223e241a597bbbc505c"
    },
    {
      "taskId": "T039",
      "lineNumber": 81,
      "sourceTaskSha256": "4eddd0ea4778ca00c92dc152cbb92195581b8c89598e8d3325db8222d6f0bd06"
    },
    {
      "taskId": "T040",
      "lineNumber": 82,
      "sourceTaskSha256": "72d2637d019157f2b6c0d20b8da7a4dcd5db2d5fee5f3c18b623bf332ae38dd4"
    },
    {
      "taskId": "T041",
      "lineNumber": 83,
      "sourceTaskSha256": "183cce3509340130789adcad078a0de3b1f1e0b3f1e7aa71739ba7a86a8a6bf1"
    },
    {
      "taskId": "T042",
      "lineNumber": 85,
      "sourceTaskSha256": "1a40deec9707f8f1daa64f9c4ff15b7c414a3a9a2d9596639e2ebe5cffc8823b"
    },
    {
      "taskId": "T043",
      "lineNumber": 84,
      "sourceTaskSha256": "96c9494851dd1f00cc29913996e277281ba4bb934b5dabafd2dbb16ed2713ca6"
    },
    {
      "taskId": "T044",
      "lineNumber": 86,
      "sourceTaskSha256": "7ada8930ec5f351f7a254f9615dbfa258b19b8bf2abca0d9160007ba6b5578fe"
    },
    {
      "taskId": "T045",
      "lineNumber": 87,
      "sourceTaskSha256": "26c52dd0a9b9edee67a57d099a0d98debdbe14fd86e8344751cedb758eb32668"
    },
    {
      "taskId": "T046",
      "lineNumber": 88,
      "sourceTaskSha256": "169cf86da1de220bfa41c9327803151071332be576f721559fb95c69d2534913"
    },
    {
      "taskId": "T047",
      "lineNumber": 89,
      "sourceTaskSha256": "868ba8accd7b0886c5d1994e781a7c8d7c9194d932d544757022b0c6ca1369d5"
    },
    {
      "taskId": "T048",
      "lineNumber": 90,
      "sourceTaskSha256": "f25887db68e1520d90ff9378e29bfa097459c854d1c16bbd2f1a231371b49677"
    },
    {
      "taskId": "T049",
      "lineNumber": 91,
      "sourceTaskSha256": "9e043559d679610af1f93cd5f458545f0cdb91e1da038c2d9ee395391658a174"
    },
    {
      "taskId": "T050",
      "lineNumber": 92,
      "sourceTaskSha256": "d24c7e612863b63f8c862cedfff4b1fe87ae20cde935942dd7a5e96c294f68ad"
    },
    {
      "taskId": "T051",
      "lineNumber": 93,
      "sourceTaskSha256": "3227ba64eb296f9e88d6d74a37146777e5ef59e630a831cc8c14d31829263ea5"
    },
    {
      "taskId": "T052",
      "lineNumber": 94,
      "sourceTaskSha256": "0dcee40884c51b85bf0dc6bdca3b9c1d8092c1f3eefd4e1e8e4b52fa4b1bfb3b"
    },
    {
      "taskId": "T053",
      "lineNumber": 95,
      "sourceTaskSha256": "b331061f0aa2a70c202182b74665444a347d7b7d5d1650b6c21494f7903b8911"
    },
    {
      "taskId": "T054",
      "lineNumber": 103,
      "sourceTaskSha256": "b8d10cabc0998b8fec84e5e0b10c955892b5868520be218650d7a1be01dfd605"
    },
    {
      "taskId": "T055",
      "lineNumber": 104,
      "sourceTaskSha256": "260145edc690c4a135e5cfc10bdaf0928d4e9a887cdfd97300462f6067ae8c0c"
    },
    {
      "taskId": "T056",
      "lineNumber": 105,
      "sourceTaskSha256": "dd4bd73d6626dcc90a033559844369e72bdb4b5aa528042159070098f2049a12"
    },
    {
      "taskId": "T057",
      "lineNumber": 106,
      "sourceTaskSha256": "ae80b6aa68475433922a527add34e4fa3367c4a981c117d24588b10bc38b462b"
    },
    {
      "taskId": "T058",
      "lineNumber": 107,
      "sourceTaskSha256": "14bc0ce359acc491cfe20c6547aac9d7d89075784e128b4b851b25d17fe5eaf7"
    },
    {
      "taskId": "T059",
      "lineNumber": 108,
      "sourceTaskSha256": "eea576d9d39626304237310d3d71f067a2136c1298d4acf3a4dc7965644fca7f"
    },
    {
      "taskId": "T060",
      "lineNumber": 109,
      "sourceTaskSha256": "b6aada198488b54f1e18527e68ced15b5ab9c90040bb3599d2faaf1dee5ecf5a"
    },
    {
      "taskId": "T061",
      "lineNumber": 110,
      "sourceTaskSha256": "9f72d76d94d33187a93a1a38d771df547d4f5456e5d26090d3130d2daca9e510"
    },
    {
      "taskId": "T062",
      "lineNumber": 111,
      "sourceTaskSha256": "fbfa36aa0e138d57908f6138d9549c0a2336a0aa5a4103d7fc7d0c0a9d2804d5"
    },
    {
      "taskId": "T063",
      "lineNumber": 119,